{
  "schema_version": "game_writer_demo_v0_4",
  "project": {
    "id": "missing_phone",
    "title": "失踪者的手机",
    "theme_question": "当真相会伤害无辜者时，你是否仍然有义务公开它？",
    "interface": "竖屏手机"
  },
  "start_scene_id": "ch01_phone_lock",
  "initial_state": {
    "clues.unsent_warning": false,
    "clues.station_location": false,
    "clues.chen_trimmed_location": false,
    "clues.wipe_pause_window": false,
    "clues.lock_time_0213": false,
    "clues.cloud_admin": false,
    "clues.freeze_token": false,
    "clues.screen_recording": false,
    "clues.chen_alias": false,
    "clues.chen_casefile": false,
    "clues.station_route_confirmed": false,
    "clues.voice_note": false,
    "clues.station_entry_code": false,
    "clues.security_booth": false,
    "clues.camera_blind_spot": false,
    "clues.ticket_warning": false,
    "clues.locker_a17": false,
    "clues.hidden_camera": false,
    "clues.backup_copy": false,
    "clues.lin_audio_key": false,
    "clues.victim_list": false,
    "clues.lin_confession": false,
    "clues.raw_recording": false,
    "clues.edited_recording": false,
    "clues.final_message": false,
    "clues.chen_motive": false,
    "clues.public_packet_ready": false,
    "clues.archive_ready": false,
    "clues.chen_message_ready": false,
    "stance.truth_first": 0,
    "stance.protect_person": 0,
    "relationships.chen.trust": 0,
    "relationships.chen.suspicion": 0,
    "relationships.lin.bond": 0,
    "pressure.company_alert": 0
  },
  "scenes": [
    {
      "id": "ch01_phone_lock",
      "chapter": "第一章：锁屏上的半句话",
      "title": "锁屏上的半句话",
      "task": "在远程清除前确认林最后联系的人。",
      "pressure": "远程清除 06:00",
      "required_for_demo": true,
      "state_echoes": [],
      "background_blocks": [
        {
          "id": "bg_ch01_phone_lock",
          "text": "手机亮起。未发送短信停在输入框里：“如果我没回来，不要相信陈...” 顶部通知显示：远程清除已排队。锁屏时间停在 02:13。",
          "observe_anchors": [
            {
              "id": "obs_unsent_sms",
              "text_range": "未发送短信",
              "label": "查看短信草稿",
              "discoverability": "obvious",
              "depth": 1,
              "effects": [
                {
                  "set": {
                    "clues.unsent_warning": true
                  }
                }
              ],
              "unlocks_choices": [],
              "opens_fragment": {
                "id": "frag_unsent_sms",
                "title": "查看短信草稿",
                "body": "草稿创建于 02:13，最后一次编辑停在“陈”字后。输入法候选里，第一个词是“陈警官”，第二个词是“陈述”。",
                "evidence_tags": [
                  "warning",
                  "chen"
                ],
                "nested_anchors": [
                  {
                    "id": "obs_0213_log",
                    "text_range": "02:13",
                    "label": "对照系统日志",
                    "discoverability": "subtle",
                    "depth": 2,
                    "effects": [
                      {
                        "set": {
                          "clues.station_location": true
                        }
                      }
                    ],
                    "unlocks_choices": [
                      "choice_go_station"
                    ],
                    "opens_fragment": {
                      "id": "frag_0213_log",
                      "title": "对照系统日志",
                      "body": "02:13 时手机短暂开启定位，地点是城北废弃地铁站。4 秒后，定位记录被手动截断。",
                      "evidence_tags": [
                        "location",
                        "station"
                      ],
                      "nested_anchors": [
                        {
                          "id": "obs_trimmed_gap",
                          "text_range": "手动截断",
                          "label": "检查截断痕迹",
                          "discoverability": "subtle",
                          "depth": 3,
                          "effects": [
                            {
                              "set": {
                                "clues.chen_trimmed_location": true
                              }
                            }
                          ],
                          "unlocks_choices": [
                            "choice_confront_chen"
                          ],
                          "opens_fragment": {
                            "id": "frag_trimmed_gap",
                            "title": "检查截断痕迹",
                            "body": "截断命令来自一个备注为“陈”的联系人号码。这不是系统自动清理。",
                            "evidence_tags": [
                              "chen",
                              "tamper"
                            ],
                            "nested_anchors": []
                          }
                        }
                      ]
                    }
                  }
                ]
              }
            },
            {
              "id": "obs_remote_wipe",
              "text_range": "远程清除",
              "label": "查看远程清除来源",
              "discoverability": "obvious",
              "depth": 1,
              "effects": [
                {
                  "add": {
                    "pressure.company_alert": 1
                  }
                }
              ],
              "unlocks_choices": [
                "choice_delay_wipe"
              ],
              "opens_fragment": {
                "id": "frag_remote_wipe",
                "title": "查看远程清除来源",
                "body": "清除请求不是来自普通云服务，而是来自林调查过的公司设备管理后台。队列里有一个临时的暂停窗口。",
                "evidence_tags": [
                  "pressure",
                  "company"
                ],
                "nested_anchors": [
                  {
                    "id": "obs_pause_window",
                    "text_range": "暂停窗口",
                    "label": "检查暂停窗口",
                    "discoverability": "subtle",
                    "depth": 2,
                    "effects": [
                      {
                        "set": {
                          "clues.wipe_pause_window": true
                        }
                      }
                    ],
                    "unlocks_choices": [
                      "choice_delay_wipe"
                    ],
                    "opens_fragment": {
                      "id": "frag_pause_window",
                      "title": "检查暂停窗口",
                      "body": "你可以让清除队列延迟六分钟，但系统会记录这次入侵。",
                      "evidence_tags": [
                        "timer"
                      ],
                      "nested_anchors": []
                    }
                  }
                ]
              }
            },
            {
              "id": "obs_time_0213",
              "text_range": "02:13",
              "label": "查看锁屏时间",
              "discoverability": "subtle",
              "depth": 1,
              "effects": [
                {
                  "set": {
                    "clues.lock_time_0213": true
                  }
                }
              ],
              "unlocks_choices": [],
              "opens_fragment": {
                "id": "frag_time_0213",
                "title": "查看锁屏时间",
                "body": "02:13 同时出现在短信草稿、定位日志和锁屏时间里。林像是故意把这个时间留给你。",
                "evidence_tags": [
                  "pattern"
                ],
                "nested_anchors": []
              }
            }
          ]
        }
      ],
      "choices": [
        {
          "id": "choice_call_chen",
          "label": "联系陈警官",
          "description": "你会把目前情况告诉他，但短信正在警告你不要相信“陈”。",
          "requirements": [],
          "effects": [
            {
              "add": {
                "relationships.chen.trust": 1
              }
            }
          ],
          "next_scene": "ch01_cloud_console",
          "irreversible": true,
          "consequence_level": "chapter",
          "outcome": "陈接得很快。他听完后只问了一句：“你看过里面的内容了吗？”"
        },
        {
          "id": "choice_go_station",
          "label": "前往废弃地铁站",
          "description": "你会离开安全地点，但手机要求先处理远程清除。",
          "requirements": [
            {
              "state": "clues.station_location",
              "equals": true
            }
          ],
          "effects": [
            {
              "add": {
                "stance.truth_first": 1
              }
            }
          ],
          "next_scene": "ch01_cloud_console",
          "irreversible": true,
          "consequence_level": "global",
          "outcome": "你把手机揣进口袋。导航路线亮起，云端控制台却先弹了出来。"
        },
        {
          "id": "choice_delay_wipe",
          "label": "延迟远程清除",
          "description": "你会保住手机内容，也会留下入侵记录。",
          "requirements": [
            {
              "state": "clues.wipe_pause_window",
              "equals": true
            }
          ],
          "effects": [
            {
              "add": {
                "pressure.company_alert": 1
              }
            }
          ],
          "next_scene": "ch01_cloud_console",
          "irreversible": true,
          "consequence_level": "global",
          "outcome": "倒计时跳回 12:00。屏幕角落多了一个你没见过的远程会话图标。"
        },
        {
          "id": "choice_confront_chen",
          "label": "带着截断记录质问陈",
          "description": "你掌握了他改动定位的痕迹，但摊牌会让他知道你已经查到这里。",
          "requirements": [
            {
              "state": "clues.chen_trimmed_location",
              "equals": true
            }
          ],
          "effects": [
            {
              "add": {
                "relationships.chen.suspicion": 2
              }
            },
            {
              "add": {
                "pressure.company_alert": 1
              }
            }
          ],
          "next_scene": "ch01_contact_trace",
          "irreversible": true,
          "consequence_level": "global",
          "outcome": "陈沉默了三秒：“你不该看到那四秒。”"
        }
      ]
    },
    {
      "id": "ch01_cloud_console",
      "chapter": "第一章：锁屏上的半句话",
      "title": "云端控制台",
      "task": "阻止手机在路上被清空。",
      "pressure": "远程会话在线",
      "required_for_demo": true,